,"ENFERMEDAD","SINTOMAS"
270,"Dengue","He desarrollado una erupción cutánea que cubre todo el cuerpo y está acompañada de un picor intenso. Me duele el cuerpo y tengo fiebre leve, acompañada de dolor de cabeza y escalofríos."
271,"Dengue","Estoy experimentando dolor corporal extremo, dolor de cabeza y vómitos. He desarrollado manchas rojas que cubren todo el cuerpo y causan un picor intenso."
272,"Dengue","Me duele la espalda todo el tiempo y tengo erupciones en brazos y cuello. Me duelen mucho los ojos por detrás. También tengo fiebre y me preocupa mi salud."
273,"Dengue","He estado sufriendo de dolor articular significativo, lo cual me dificulta caminar y realizar mis tareas cotidianas. También he perdido el apetito, lo cual me hace sentir débil y con ganas de vomitar."
274,"Dengue","Hay un dolor constante detrás de los ojos. Me han salido manchas rojas en el cuello y la cara y erupciones en los brazos. Me duelen mucho los brazos y las piernas. Las manchas pican y son incómodas y me preocupa."
275,"Dengue","Me he estado sintiendo enfermo y siento una fuerte necesidad de vomitar. Hay un dolor agudo detrás de los ojos y puntos rojos hinchados por toda la espalda."
276,"Dengue","Mis tiritones y escalofríos han estado acompañados de una sensación de frío y fiebre muy alta. También me han aparecido erupciones en los brazos y manchas rojas en el cuello."
277,"Dengue","He estado sufriendo de dolor articular severo. Tengo ganas de vomitar la mayor parte del tiempo y estoy desarrollando fiebre moderada con escalofríos. La fiebre no parece bajar ni con medicación."
278,"Dengue","Los vómitos que he estado teniendo han sido seguidos de dolores de estómago y mareos. He perdido el apetito y como resultado me siento débil. Me duelen los brazos, la espalda y el cuello la mayor parte del tiempo."
279,"Dengue","Me han salido manchas rojas en brazos y piernas que pican y están inflamadas. Me he estado sintiendo con náuseas y tengo una necesidad constante de vomitar. Esto está acompañado de fiebre leve."
280,"Dengue","He desarrollado una erupción cutánea que cubre todo el cuerpo. La erupción está roja e hinchada y es peor en ciertas áreas como los brazos y las piernas. También he perdido el apetito."
281,"Dengue","He estado experimentando escalofríos y tiritones. Hay un fuerte dolor en la espalda y también detrás de los ojos. También he notado pequeñas manchas rojas en la espalda y el cuello."
282,"Dengue","He estado experimentando dolor articular severo que me está haciendo el día muy difícil. Tengo ganas de vomitar todo el tiempo y también tengo un leve dolor de cabeza."
283,"Dengue","He estado vomitando con frecuencia y he perdido el apetito como resultado. Tengo erupciones en la piel y me duelen los ojos, por lo cual no puedo dormir bien."
284,"Dengue","Tengo fiebre alta junto con un dolor de cabeza severo. La fiebre está acompañada de dolor corporal extremo y escalofríos. Estoy preocupado por mi salud y no sé qué hacer."
285,"Dengue","Me he estado sintiendo extremadamente cansado y fatigado, y no tengo energía para hacer nada. La fatiga es tan severa que me cuesta salir de la cama. He notado pequeñas manchas rojas en brazos y piernas."
286,"Dengue","He estado experimentando un dolor de cabeza severo que está acompañado de dolor detrás de los ojos. Me siento cansado y fatigado, por lo cual no puedo trabajar en todo el día. Estoy preocupado por mi salud."
287,"Dengue","Me he estado sintiendo con náuseas y tengo una necesidad constante de vomitar, lo cual está acompañado de fiebre leve y dolor de cabeza."
288,"Dengue","Me han salido erupciones en el cuerpo que pican. He perdido el apetito y me siento muy cansado todo el día. Siento que algo va mal en mi cuerpo."
289,"Dengue","He estado experimentando dolor muscular y dolor de cabeza. El dolor muscular se siente como un dolor constante y empeora al intentar usar los músculos afectados. Me están saliendo pequeñas manchas rojas en la cara, el cuello y los brazos."
290,"Dengue","Me duele la espalda y tengo erupciones en los brazos y las axilas. Me duelen mucho los globos oculares por detrás. También tengo fiebre leve, lo cual nos preocupa por mi salud."
291,"Dengue","Estoy experimentando fiebre muy alta y escalofríos cada noche. Me preocupa mucho. Además, no tengo ganas de comer nada y me duelen mucho la espalda, los brazos y las piernas. Hay un dolor extraño detrás de los ojos. No puedo hacer ninguna actividad física."
292,"Dengue","Como resultado de mis vómitos regulares, he perdido el apetito. Me duelen constantemente los músculos, las articulaciones y la espalda. También me está empezando a dar fiebre. Estoy muy preocupado y no sé qué hacer."
293,"Dengue","He estado experimentando fiebre alta que está acompañada de dolor detrás de los ojos y dolor de cabeza. Me siento cansado y agotado, por lo cual no puedo hacer ningún trabajo."
294,"Dengue","Me duele mucho todo el cuerpo y no tengo ganas de comer nada. Tengo fiebre leve y escalofríos cada noche. Además, me están saliendo algunas manchas rojas en la espalda y el cuello."
295,"Dengue","Me duelen las articulaciones y la espalda cada día. Tengo ganas de vomitar y esto me ha debilitado mucho. Debido al dolor corporal, no puedo concentrarme en el trabajo y no tengo ganas de hacer nada."
296,"Dengue","El dolor corporal que he estado sintiendo es extremo. He perdido el apetito y me han salido erupciones en brazos y cara. Me duelen mucho los ojos por detrás."
297,"Dengue","Me han salido erupciones en el cuerpo. También estoy experimentando fiebre alta junto con escalofríos y dolor de cabeza. Me duelen las articulaciones y la espalda y hay un dolor extraño en la parte posterior de los ojos."
298,"Dengue","Me he estado sintiendo con náuseas y tengo una necesidad constante de vomitar. Tengo fiebre alta y escalofríos cada noche y me siento fatal por esto. Además, siento que he perdido el apetito."
299,"Dengue","Hay erupciones en la piel, que me pican al tocarlas. No me siento bien ya que me duelen las articulaciones todo el día. Por la noche, tengo fiebre leve y escalofríos, por lo cual tampoco puedo dormir."
300,"Infección Fúngica","Tengo bultos elevados, una erupción que se ve roja e inflamada, zonas de piel descoloridas que son de colores diferentes al resto de mi piel, y picazón en la piel."
301,"Infección Fúngica","Por todo el cuerpo me ha dado una picazón intensa seguida de una erupción roja y abultada. También tengo algunas manchas oscurecidas y unos pequeños brotes nodulares. Lleva varios días y va empeorando."
302,"Infección Fúngica","Me ha salido una erupción en la piel que parece manchas discrómicas, y también tengo muchas erupciones nodulares y una picazón muy fuerte. Durante la semana pasada ha empeorado."
303,"Infección Fúngica","Tengo una erupción que no desaparece y una picazón molesta en la piel. Además, he visto algunas zonas de color diferente y bultos que parecen nudos o protuberancias en la piel."
304,"Infección Fúngica","Tengo una erupción por todo el cuerpo y no puedo dejar de rascarme porque me pica la piel. Mi piel también tiene algunas manchas donde el tono está alterado y algunos bultos y granos como nudos."
305,"Infección Fúngica","Últimamente me ha picado bastante la piel y tengo una erupción por todo el cuerpo. La piel también tiene algunas manchas donde el tono está alterado y algunos bultos y granos como nudos."
306,"Infección Fúngica","Me ha estado picando mucho la piel y me está saliendo una erupción. Además, tengo algunas zonas de la piel que son de un tono diferente al resto. También tengo unos cuantos granos o brotes duros en la piel."
307,"Infección Fúngica","Me ha estado picando todo el cuerpo a lo loco, y ahora tengo zonas rojas por todas partes. Además, algunas de las manchas tienen un tono diferente al de mi piel natural. Y en la piel me han salido estos bultos o granos."
308,"Infección Fúngica","Mi piel últimamente se ha estado alterando, volviéndose extremadamente picante y propensa a erupciones. Además, hay ciertas manchas que se desvían de mi tono de piel natural en cuanto a color. Y ahora me han salido estos bultos o protuberancias que antes no estaban."
309,"Infección Fúngica","En brazos y piernas tengo muchos granos rojos y picazón en la piel. La piel también tiene unas lesiones de aspecto extraño. Y de vez en cuando hay bultos que son algo incómodos."
310,"Infección Fúngica","Tengo picazón en la piel y muchos bultos rojos en brazos y piernas. También tengo algunas manchas de aspecto raro en la piel. Y a veces hay bultos que se sienten algo duros."
311,"Infección Fúngica","Doctor, tengo una erupción que pica mucho en la piel y hay unas manchas raras de un color diferente. También hay unos bultos en la piel que parecen nudos pequeños."
312,"Infección Fúngica","Doctor, mi piel está cubierta de una erupción muy incómoda, junto con unas manchas extrañas de un tono diferente. También tengo unos cuantos granos que parecen nudos pequeños."
313,"Infección Fúngica","Tengo muchas manchas que pican en la piel y a veces se ponen rojas o abultadas. También hay unas manchas extrañas de colores diferentes al resto de mi piel, y a veces me salen estos bultos raros que parecen bolitas."
314,"Infección Fúngica","Con frecuencia me salen bultos que pican en la piel que a veces se vuelven rojos o ásperos. Aparte de eso, de vez en cuando me salen granos extraños que parecen bolitas y unas manchas raras de un tono diferente al resto de mi piel."
315,"Infección Fúngica","Doctor, tengo estas erupciones rojas que no dejan de aparecer y la piel me pica continuamente. Además, he observado unas manchas extrañas de color diferente en la piel, así como unos pequeños nódulos que parecen estar expandiéndose."
316,"Infección Fúngica","He estado experimentando una picazón realmente intensa por todo el cuerpo, junto con enrojecimiento y bultos en la piel. También hay estas manchas extrañas que son de colores diferentes al resto de mi piel, y a veces me salen estos nódulos que parecen pequeños bultos."
317,"Infección Fúngica","Por todo el cuerpo me he estado rascando tanto que la piel se me ha puesto roja y me han salido granos. Además, de vez en cuando me salen estos nódulos que parecen granitos, así como estas manchas extrañas de un tono diferente al resto de mi piel."
318,"Infección Fúngica","He estado experimentando mucha picazón, que ha estado acompañada de una erupción que parece ir empeorando con el tiempo. También hay ciertas zonas de la piel que son de colores diferentes al resto, y he visto varios bultos que parecen pequeños nódulos."
319,"Infección Fúngica","He estado teniendo muchos problemas de picazón, y ha estado acompañada de una erupción que parece estar empeorando con el tiempo. También hay algunas manchas de piel que son de colores diferentes al resto, y he notado algunos bultos que parecen nódulos pequeños."
320,"Infección Fúngica","Doctor, mi piel está cubierta de una erupción incómoda y tiene unas cuantas manchas extrañas de un color diferente. Hay unos cuantos granos en mi piel que parecen nudos pequeños."
321,"Infección Fúngica","Me ha estado picando mucho, y ha estado acompañado de una erupción que parece estar empeorando con el tiempo. También hay algunas manchas de piel que son de colores diferentes al resto de la piel, así como unos bultos que parecen nódulos pequeños."
322,"Infección Fúngica","Mi piel últimamente se ha estado alterando, volviéndose excesivamente picante y propensa a erupciones. Además, varias manchas difieren de mi tono de piel normal en cuanto a color. Y ahora tengo bultos o protuberancias en la piel que antes no estaban."
323,"Infección Fúngica","Una erupción que parece estar desarrollándose por toda la piel ha estado acompañando mis recientes episodios de picazón intensa y malestar. En la piel también tengo algunas manchas discrómicas y pequeños bultos que parecen estar apareciendo por todas partes."
324,"Infección Fúngica","Mi piel siempre pica, y de vez en cuando se vuelve bastante áspera y roja. Además, ocasionalmente me salen pequeños granos que parecen bolitas y ciertas manchas que son de un color diferente al resto de mi piel. Me irrita y pica mucho."
325,"Infección Fúngica","Tengo mucha picazón por toda la piel, y a veces se pone realmente roja y abultada. También hay algunas manchas que son de colores diferentes al resto de mi piel, y a veces me salen estos pequeños bultos que parecen bolitas. Es muy molesto y pica."
326,"Infección Fúngica","Tengo una picazón bastante irritante por todo el cuerpo, y mi piel también tiene unas cuantas zonas rojas y abultadas. También he tenido algunos granos que parecen bolitas y otras manchas que son de un color diferente al resto de mi piel."
327,"Infección Fúngica","He tenido una picazón bastante incómoda por todo el cuerpo, así como zonas rojas y abultadas en la piel. También hay ciertas manchas de mi piel que son de un tono diferente al resto, y he tenido algunos granos que parecen bolitas."
328,"Infección Fúngica","He estado teniendo esta picazón realmente molesta por todo el cuerpo, y también tengo manchas rojas y abultadas en la piel. También hay algunas zonas que son de un color diferente al resto de mi piel, y he tenido algunos bultos que parecen bolitas."
329,"Infección Fúngica","He tenido una picazón bastante incómoda por todo el cuerpo, así como zonas rojas y abultadas en la piel. También hay ciertas manchas de mi epidermis con un tono distinto al resto, y he tenido algunos granos que parecen bolitas."
330,"Infección Fúngica","Últimamente me ha picado mucho y tengo estas manchas con erupción por toda la piel. También hay algunas zonas que se ven de un tono diferente al resto de mi piel, y he tenido algunos bultos que son algo duros."
331,"Infección Fúngica","He estado bastante picante recientemente, y tengo manchas con erupción por toda la piel. También hay ciertas regiones que son más oscuras en color que el resto de mi piel, y tengo unos bultos firmes."
332,"Infección Fúngica","He estado bastante picante recientemente, y tengo manchones con erupción por toda la piel. También hay ciertas regiones que son de color más oscuro que el resto de mi piel, y tengo unos bultos dolorosos."
333,"Infección Fúngica","Últimamente me he estado rascando mucho, y la piel está cubierta de zonas con erupción. Además, he tenido unos cuantos granos que son bastante firmes, y hay ciertas manchas en mi cuerpo que tienen un tono de marrón diferente al resto de mi piel."
334,"Infección Fúngica","Me ha picado mucho la piel y tengo estas manchas con erupción por todas partes. También hay algunas manchas que se ven de color diferente al resto de mi piel, y he tenido algunos bultos que son algo duros."
335,"Infección Fúngica","Me ha picado mucho la piel, y tengo erupciones por todo el cuerpo. Tengo algunos bultos que son bastante firmes, así como algunas zonas que son de un tono más oscuro que el resto de mi piel. Es extremadamente desagradable."
336,"Infección Fúngica","Hay zonas con erupción por toda la piel, lo cual ha sido muy irritante. Además, tengo algunos bultos que son bastante firmes y algunas manchas que son de un color diferente al resto de mi piel."
337,"Infección Fúngica","Últimamente me he estado rascando mucho, y la piel está cubierta de zonas con erupción. Además, hay unas cuantas manchas donde mi piel no parece tener su tono habitual, y he experimentado unos cuantos bultos que son bastante dolorosos."
338,"Infección Fúngica","Últimamente me ha picado mucho y tengo estas manchas con erupción por toda la piel. También hay algunas zonas que no se ven como el color normal de mi piel, y he tenido algunos bultos que son algo duros."
339,"Infección Fúngica","He estado bastante picante recientemente, y tengo zonas con erupción por todo el cuerpo. También hay algunas regiones que no parecen tener el tono típico de mi piel, y he experimentado unos bultos firmes."
340,"Infección Fúngica","Últimamente me ha estado picando y tengo manchas con erupción por toda la piel. También hay algunas regiones que no parecen tener el tono regular de mi piel, y he experimentado unos bultos dolorosos."
341,"Infección Fúngica","Últimamente me he estado rascando mucho, y la piel está cubierta de manchas con erupción. Además, hay unas cuantas regiones donde mi piel no parece tener su tono habitual, y he experimentado unos cuantos bultos que son excepcionalmente dolorosos."
342,"Infección Fúngica","He estado teniendo esta picazón constante y tengo estas manchas rojas y abultadas en la piel. También hay algunas manchas que son de un color diferente al resto de mi piel, y he tenido algunos bultos que son como pequeños grumos."
343,"Infección Fúngica","Hay zonas rojas y abultadas en mi piel, y me he estado rascando sin parar. Además, tengo algunos bultos que parecen pequeños grumos y algunas manchas que son de un tono de piel diferente al resto de mi cuerpo."
344,"Infección Fúngica","He tenido mucha picazón en la piel, que de vez en cuando se convierte en una erupción. También hay unas manchas extrañas de piel que son de un tono diferente al resto de mí, y de vez en cuando me salen pequeños granos que parecen nódulos."
345,"Infección Fúngica","He tenido tendencia a la picazón en la piel, que con frecuencia se convierte en una erupción. También hay unas manchas extrañas de piel que son de un tono diferente al resto de mi piel, y regularmente me salen pequeños bultos que imitan nódulos."
346,"Infección Fúngica","He estado experimentando mucha picazón en la piel, y a veces se convierte en una erupción. También hay unas manchas extrañas de piel que son de un color diferente al resto de mí, y a veces me salen pequeños bultos que parecen nódulos."
347,"Infección Fúngica","Me ha estado picando terriblemente por todo el cuerpo, y ahora hay manchas rojas por todas partes. Algunas de las manchas también difieren en tono de mi tez natural. Y están estos bultos o granos que me han aparecido en la piel."
348,"Infección Fúngica","Últimamente me ha picado mucho la piel, y de vez en cuando brota una erupción. Además, tengo unas cuantas zonas extrañas de piel que son de una coloración diferente al resto de mí, y de vez en cuando me salen pequeños bultos que parecen nódulos."
349,"Infección Fúngica","Ahora hay manchones rojos por todo el cuerpo donde me ha estado picando terriblemente. Algunas de las manchas también difieren en tez de mi piel natural. Y estos bultos o protuberancias me han salido en la piel."
350,"Resfriado Común","No puedo dejar de estornudar y me gotea mucho la nariz. También tengo mucho frío y cansancio todo el tiempo, y he estado tosiendo mucho. La fiebre también es muy alta, muy por encima de lo normal."
351,"Resfriado Común","Me gotea muchísimo la nariz y no consigo dejar de estornudar. Además, constantemente tengo frío, estoy agotado y he estado tosiendo mucho. La fiebre también está muy alta, muy por encima de lo normal."
352,"Resfriado Común","He estado estornudando sin parar y no consigo quitarme este frío. Me siento muy débil y cansado, y la tos no se me va. Tengo mucha fiebre."
353,"Resfriado Común","He estado estornudando incesantemente y simplemente no consigo que se me quite este frío. Me siento tan débil y agotado, y la tos no para. Tengo la temperatura muy alta."
354,"Resfriado Común","Estornudo constantemente y el cuerpo me tiembla del frío. Estoy tan cansado que apenas puedo moverme y la cabeza me mata. La fiebre está por las nubes."
355,"Resfriado Común","Estornudo constantemente, y el frío me hace temblar el cuerpo. Estoy tan agotado que apenas puedo moverme, y me duele la cabeza. Tengo bastante fiebre."
356,"Resfriado Común","He estado bastante agotado y enfermo. Estornudo sin parar y tengo bastante frío. Me late la cabeza y me falta energía. Además, tengo mucha fiebre y siento que estoy ardiendo."
357,"Resfriado Común","Me he estado sintiendo muy cansado y enfermo. He estado estornudando mucho y no consigo entrar en calor. Estoy tan cansado y la cabeza me mata. Y la fiebre es muy alta, como si estuviera hirviendo."
358,"Resfriado Común","He estado bastante agotado y enfermo. Me ha dolido bastante la garganta y he tenido una tos bastante fea. Tengo muchos escalofríos y una temperatura bastante alta. Simplemente me siento extremadamente decaído y débil."
359,"Resfriado Común","He estado bastante agotado y enfermo. He estado estornudando mucho y me cuesta entrar en calor. Estoy tan agotado y me duele la cabeza. Y siento que estoy hirviendo con la fiebre alta."
360,"Resfriado Común","No puedo dejar de estornudar y me siento muy cansado y mal. Me duele mucho la garganta y tengo mucha mucosidad espesa en la nariz y la garganta. También siento el cuello hinchado e inflamado."
361,"Resfriado Común","No puedo dejar de estornudar, y estoy agotado y enfermo. Tengo la garganta muy incómoda y hay mucha porquería en la nariz y la garganta. El cuello también está hinchado e inflamado."
362,"Resfriado Común","No paro de estornudar, y estoy miserable y agotado. Tengo muchas cosas pegajosas en la nariz y la garganta, y la garganta me duele mucho. El cuello también lo siento inflamado e hinchado."
363,"Resfriado Común","Me he estado sintiendo muy agotado y mal del estómago. He tenido una tos muy fuerte y me ha dolido mucho la garganta. He experimentado una presión sinusal considerable y la nariz congestionada. Estoy muy incómodo y agotado."
364,"Resfriado Común","He estado estornudando mucho y sintiéndome muy cansado y enfermo. También me sale mucha cosa asquerosa de la nariz y siento la garganta muy irritada. Y también siento el cuello hinchado."
365,"Resfriado Común","He estado resollando mucho y en general me siento enfermo y agotado. Siento la garganta muy irritada y me sale mucha cosa asquerosa de la nariz. También siento el cuello hinchado."
366,"Resfriado Común","Siento los senos nasales increíblemente congestionados y los ojos continuamente rojos. Simplemente me siento constantemente agotado y exhausto. Además, tengo mucha flema incómoda en la garganta. Siento los ganglios linfáticos inflamados y la respiración ha sido difícil."
367,"Resfriado Común","He tenido los ojos muy rojos y siento los senos nasales congestionados. Simplemente no tengo nada de energía y me ha picado mucho la garganta. También he notado los ganglios linfáticos inflamados y he estado tosiendo mucha flema."
368,"Resfriado Común","Siento los senos nasales tapados y he tenido los ojos bastante rojos. Simplemente me falta energía, y la garganta me ha estado picando mucho. Junto con la inflamación de los ganglios linfáticos, también he estado tosiendo mucha flema."
369,"Resfriado Común","Siempre tengo los ojos rojos y con picazón, y la nariz la siento tapada y congestionada. Simplemente me siento algo enfermo y cansado todo el tiempo, y no paro de toser toda esta porquería. Siento la garganta irritada y con picazón, y he notado que los bultos del cuello están más grandes de lo normal."
370,"Resfriado Común","Siempre siento la nariz tapada y congestionada, y los ojos siempre rojos y con picazón. Tengo la sensación de estar mal y fatigado, y no paro de soltar esta porquería. Tengo la garganta irritada y con picazón, y he visto que los bultos del cuello están más grandes de lo normal."
371,"Resfriado Común","No paro de estornudar y los ojos no dejan de lagrimear. Me cuesta muchísimo respirar porque siento como si tuviera algo atascado en la garganta. A menudo me siento agotado y últimamente he tenido mucha flema. Además, tengo los ganglios linfáticos agrandados."
372,"Resfriado Común","Tengo los ojos rojos y llorosos todo el tiempo. También he tenido esta presión en los senos nasales que no desaparece. Siempre me siento cansado y he estado teniendo muchos problemas para respirar. También he tenido mucha porquería en la garganta y los ganglios linfáticos están hinchados."
373,"Resfriado Común","Tengo los ojos constantemente rojos y llorosos. También me ha estado molestando una tensión persistente en los senos nasales. He estado teniendo muchas dificultades para respirar y me siento fatigado constantemente. Además, tengo mucha mucosidad en la garganta y los ganglios linfáticos inflamados."
374,"Resfriado Común","Siento la nariz bastante tapada y los ojos constantemente muy rojos y llorosos. Además, me duele el pecho y he estado teniendo muchos problemas respiratorios. Además, los músculos me duelen bastante y no puedo oler nada."
375,"Resfriado Común","Normalmente tengo los ojos rojos y llorosos, y la nariz siempre está tapada. También he estado teniendo dificultad para respirar y me duele el pecho. Además, no puedo oler nada y los músculos me duelen bastante."
376,"Resfriado Común","Normalmente tengo los ojos rojos e inflamados, y tengo la impresión de que algo me está obstruyendo los senos nasales. He estado tosiendo mucha porquería y me duele el pecho. No puedo oler nada y me duelen los músculos."
377,"Resfriado Común","Siempre tengo los ojos rojos e hinchados, y siento como si tuviera algo bloqueándome los senos nasales. He estado tosiendo mucha mucosidad y siento el pecho muy pesado. No puedo oler nada y me duelen mucho los músculos."
378,"Resfriado Común","He estado tosiendo mucho y sintiéndome con frío y escalofríos. He tenido la nariz bastante tapada y siento presión facial. También tengo mucha flema, y al toser me duele el pecho. No puedo oler nada y me duelen los músculos."
