,"ENFERMEDAD","SINTOMAS"
489,"Hemorroides Dimórficas","Recientemente he estado sufriendo de estreñimiento y molestias digestivas. El ano me duele bastante y me ha estado sangrando cada vez que voy. Es terriblemente doloroso y estoy bastante inquieto."
490,"Hemorroides Dimórficas","He estado experimentando muchos problemas con las evacuaciones intestinales recientemente. Es difícil ir y duele al hacerlo. El ano me duele bastante y me ha estado sangrando cada vez que voy. Es terriblemente doloroso y estoy bastante inquieto."
491,"Hemorroides Dimórficas","Estoy teniendo muchos problemas con mis evacuaciones intestinales últimamente. Cuesta ir y duele al hacerlo. El ano me duele mucho y me ha estado sangrando al ir. Es muy doloroso y estoy muy incómodo."
492,"Hemorroides Dimórficas","Mis evacuaciones intestinales me han resultado muy difíciles recientemente. Ir es difícil y me duele al hacerlo. Cuando voy, el ano me sangra y es muy incómodo. Tengo muchas molestias y duele muchísimo."
493,"Hemorroides Dimórficas","He estado experimentando muchos problemas con mis evacuaciones intestinales recientemente. Es difícil ir y duele al hacerlo. El ano me duele bastante y me ha estado sangrando cada vez que voy. Es terriblemente doloroso y estoy bastante inquieto."
494,"Hemorroides Dimórficas","He estado experimentando muchos problemas con las evacuaciones intestinales recientemente. Es difícil ir y duele al hacerlo. El ano me duele bastante y me ha estado sangrando cada vez que voy. Es muy doloroso y estoy muy incómodo."
495,"Hemorroides Dimórficas","He estado teniendo muchos problemas intestinales recientemente. Me cuesta ir, y me duele al hacerlo. El ano me duele bastante y me ha estado sangrando cada vez que voy. Es terriblemente doloroso y estoy bastante inquieto."
496,"Hemorroides Dimórficas","Últimamente me ha costado mucho ir al baño. Es muy doloroso y solo puedo ir cada pocos días. También hay mucho dolor en el ano y alrededor de esa zona. Las heces han sido muy sanguinolentas y siento el ano muy irritado."
497,"Hemorroides Dimórficas","Me ha resultado increíblemente difícil recientemente usar el baño. Solo puedo ir esporádicamente porque duele mucho. El ano y la región circundante también están muy doloridos. Siento el ano muy irritado y las heces han sido extremadamente sanguinolentas."
498,"Hemorroides Dimórficas","Estoy teniendo muchos problemas de estreñimiento y dolor al intentar ir al baño. Me duele mucho el ano y la zona de alrededor. Las heces han sido sanguinolentas y el ano está muy irritado."
499,"Hemorroides Dimórficas","El estreñimiento y las molestias al defecar han sido muy comunes para mí últimamente. Tanto la región que rodea el ano como yo mismo sufrimos mucho dolor. Me pica mucho el ano y las heces han sido sanguinolentas."
500,"Artritis","He estado sintiendo los músculos muy débiles y el cuello extremadamente tenso. He estado experimentando mucha rigidez al caminar y las articulaciones se me han hinchado. Caminar también ha sido muy incómodo."
501,"Artritis","Me he estado sintiendo muy débil de los músculos y el cuello lo he tenido muy rígido. Las articulaciones se me han estado hinchando y he tenido mucha rigidez al moverme. También ha sido muy doloroso caminar."
502,"Artritis","He tenido los músculos bastante débiles y el cuello muy rígido. Las articulaciones se me han hinchado y he estado experimentando mucha rigidez al moverme. Caminar también ha sido terriblemente incómodo."
503,"Artritis","Me he estado sintiendo muy débil de los músculos y el cuello lo he tenido muy rígido. Las articulaciones se me han estado hinchando y me ha costado moverme. Caminar ha sido muy doloroso."
504,"Artritis","He tenido los músculos muy débiles y el cuello extremadamente rígido. Las articulaciones se me han hinchado, dificultándome moverme. Caminar ha sido terriblemente incómodo."
505,"Artritis","He estado experimentando una debilidad muscular severa y el cuello lo he tenido muy rígido. Me ha costado moverme porque las articulaciones se me han hinchado. Ha sido muy incómodo caminar."
506,"Artritis","He estado sintiendo los músculos muy débiles y el cuello extremadamente tenso. Las articulaciones se me han hinchado, dificultándome el movimiento. Me ha dolido mucho caminar."
507,"Artritis","He tenido el cuello muy tenso y he estado sintiendo que los músculos están increíblemente débiles. Me cuesta moverme porque las articulaciones se me han agrandado. Caminar ha sido bastante doloroso."
508,"Artritis","He tenido el cuello muy rígido y una debilidad muscular terrible. Debido a la hinchazón de las articulaciones, me ha costado moverme. Caminar ha sido bastante desagradable."
509,"Artritis","Últimamente me he estado sintiendo muy débil de los músculos y el cuello lo he tenido muy rígido. Las articulaciones se me han estado hinchando y me cuesta moverme sin sentir rigidez. Caminar también ha sido muy doloroso."
510,"Artritis","Recientemente, he sentido los músculos bastante débiles y el cuello lo he tenido muy tenso. Tengo las articulaciones hinchadas y me cuesta moverme sin quedarme rígido. También ha sido muy incómodo caminar."
511,"Artritis","He estado experimentando debilidad muscular y rigidez en el cuello recientemente. Las articulaciones se me han hinchado, dificultándome caminar sin quedarme rígido. Caminar también ha sido terriblemente incómodo."
512,"Artritis","Recientemente, he estado sufriendo debilidad y rigidez en los músculos del cuello. Las articulaciones se me han agrandado y me cuesta caminar sin sentirme rígido. Caminar también ha sido terriblemente incómodo."
513,"Artritis","Últimamente, he tenido el cuello tenso y los músculos debilitados. Tengo las articulaciones hinchadas que me dificultan moverme sin quedarme rígido. También ha sido terriblemente doloroso caminar."
514,"Artritis","Me he estado sintiendo muy débil de los músculos y el cuello lo he tenido muy rígido. Las articulaciones se me han estado hinchando y me cuesta moverme sin sentir rigidez. Caminar también ha sido muy doloroso."
515,"Artritis","He estado sintiendo los músculos muy débiles y el cuello extremadamente tenso. Tengo las articulaciones hinchadas y me cuesta moverme sin quedarme rígido. También ha sido muy incómodo caminar."
516,"Artritis","He tenido los músculos bastante débiles y el cuello muy rígido. Las articulaciones se me han hinchado, dificultándome caminar sin quedarme rígido. Caminar también ha sido terriblemente incómodo."
517,"Artritis","He tenido los músculos muy débiles y el cuello extremadamente rígido. Las articulaciones se me han hinchado, dificultándome caminar sin sentirme rígido. Caminar también ha sido muy incómodo."
518,"Artritis","He tenido los músculos bastante débiles y el cuello muy rígido. Las articulaciones se me han hinchado, dificultándome moverme sin quedarme rígido. Caminar también ha sido bastante incómodo."
519,"Artritis","He tenido el cuello muy tenso y los músculos bastante débiles. Tengo las articulaciones hinchadas que me dificultan moverme sin quedarme rígido. Además, caminar ha sido bastante desagradable."
520,"Artritis","Me he estado sintiendo muy débil de los músculos y el cuello lo he tenido muy rígido. Las articulaciones se me han estado hinchando y me cuesta moverme sin sentir rigidez. Caminar también ha sido muy doloroso."
521,"Artritis","He estado sintiendo los músculos muy débiles y el cuello extremadamente tenso. Tengo las articulaciones hinchadas y me cuesta moverme sin quedarme rígido. También ha sido muy incómodo caminar."
522,"Artritis","He tenido el cuello extremadamente tenso y los músculos los he estado sintiendo extremadamente débiles. Me cuesta moverme sin quedarme rígido debido a las articulaciones hinchadas. Caminar también ha sido extremadamente incómodo."
523,"Artritis","He tenido el cuello extremadamente rígido y los músculos extremadamente débiles. Como resultado de la hinchazón en las articulaciones, me cuesta moverme sin sentirme rígido. Además, caminar ha sido extremadamente incómodo."
524,"Artritis","He estado experimentando rigidez y debilidad en los músculos del cuello recientemente. Como las articulaciones me han crecido, me cuesta caminar sin quedarme rígido. Además, caminar ha sido extremadamente incómodo."
525,"Artritis","He tenido el cuello extremadamente tenso y los músculos los he estado sintiendo extremadamente débiles. Las articulaciones se me han hinchado y he estado caminando con mucha rigidez. Además, caminar ha sido extremadamente incómodo."
526,"Artritis","He estado experimentando rigidez y debilidad en los músculos del cuello recientemente. Como las articulaciones me han crecido, me cuesta caminar sin quedarme rígido. Además, caminar ha sido extremadamente incómodo."
527,"Artritis","Me he estado sintiendo muy débil de los músculos y el cuello lo he tenido muy rígido. Las articulaciones se me han estado hinchando y me cuesta moverme sin sentir rigidez. Caminar también ha sido muy doloroso."
528,"Artritis","He tenido los músculos bastante débiles y el cuello muy rígido. Las articulaciones se me han hinchado, dificultándome caminar sin sentirme rígido. Caminar también ha sido muy incómodo."
529,"Artritis","He estado experimentando una debilidad muscular severa y el cuello lo he tenido muy rígido. Tengo las articulaciones hinchadas y me cuesta moverme sin quedarme rígido. También ha sido muy incómodo caminar."
530,"Artritis","Últimamente me he estado sintiendo muy débil de los músculos y el cuello lo he tenido muy rígido. Las articulaciones las he tenido hinchadas y me cuesta moverme. También me ha dolido caminar."
531,"Artritis","Me he estado sintiendo verdaderamente frágil de los músculos recientemente y el cuello lo he tenido verdaderamente sólido. Las articulaciones hinchadas me dificultan moverme. Caminar también ha sido difícil."
532,"Artritis","Recientemente, he sentido los músculos bastante débiles y el cuello lo he tenido muy tenso. Tengo las articulaciones hinchadas, lo que me dificulta el movimiento. Caminar también ha sido doloroso."
533,"Artritis","He estado experimentando debilidad muscular y rigidez en el cuello recientemente. Las articulaciones se me han agrandado, dificultándome el movimiento. Caminar también ha sido difícil."
534,"Artritis","Me he estado sintiendo verdaderamente frágil de los músculos recientemente y el cuello lo he tenido verdaderamente sólido. Me ha costado moverme porque las articulaciones se me han estado hinchando. Caminar también ha sido extremadamente doloroso."
535,"Artritis","Últimamente he sentido los músculos débiles, pero el cuello lo he tenido como una roca. Las articulaciones se me han hinchado, dificultándome moverme. Caminar también ha sido bastante incómodo."
536,"Artritis","Últimamente he sentido los músculos bastante débiles, pero el cuello lo he tenido muy fuerte. Las articulaciones se me han hinchado, haciéndome difícil moverme. También ha sido terriblemente difícil caminar."
537,"Artritis","He tenido el cuello extremadamente tenso y los músculos los he sentido bastante débiles recientemente. Me cuesta moverme sin quedarme rígido debido a las articulaciones hinchadas. Caminar también ha sido extremadamente incómodo."
538,"Artritis","He estado experimentando rigidez y debilidad en los músculos del cuello recientemente. Como las articulaciones me han crecido, me cuesta caminar sin quedarme rígido. Además, caminar ha sido terriblemente incómodo."
539,"Artritis","He estado experimentando debilidad muscular y rigidez en el cuello recientemente. Las articulaciones se me han hinchado, dificultándome caminar sin quedarme rígido. Caminar también ha sido terriblemente incómodo."
540,"Artritis","Tengo los músculos bastante débiles y el cuello lo he tenido muy rígido. Las articulaciones se me han hinchado, dificultándome caminar sin sentirme rígido. Caminar también ha sido muy incómodo."
541,"Artritis","Mis músculos están bastante débiles y el cuello lo he tenido terriblemente rígido. Las articulaciones se me han hinchado, haciéndome difícil caminar sin sentirme rígido. Caminar también ha sido terriblemente incómodo."
542,"Artritis","He estado experimentando rigidez y debilidad en los músculos del cuello recientemente. Como las articulaciones me han crecido, me cuesta caminar sin quedarme rígido. Además, caminar ha sido extraordinariamente incómodo."
543,"Artritis","He tenido el cuello muy tenso y los músculos los he sentido bastante débiles recientemente. Me cuesta moverme sin quedarme rígido debido a las articulaciones hinchadas. Caminar también ha sido muy incómodo."
544,"Artritis","Recientemente, cuando intento caminar, tengo rigidez, cuello rígido, articulaciones hinchadas y debilidad muscular. Caminar también ha sido muy incómodo."
545,"Artritis","Últimamente he estado experimentando debilidad muscular, cuello rígido, hinchazón de articulaciones y rigidez al intentar moverme. También ha sido muy doloroso caminar."
546,"Artritis","Recientemente, los músculos del cuello se me han puesto tensos y débiles. Ahora me cuesta caminar porque las articulaciones están más viejas sin ponerse tensas. El acto de caminar también ha sido bastante desagradable."
547,"Artritis","He estado experimentando rigidez y debilidad en los músculos del cuello recientemente. Como las articulaciones me han crecido, me cuesta caminar sin quedarme rígido. Además, caminar ha sido muy incómodo."
548,"Artritis","Recientemente, los músculos del cuello se me han puesto tensos y débiles. Como las articulaciones me han madurado, me cuesta caminar sin quedarme rígido. Caminar también ha sido bastante desagradable."
549,"Artritis","Últimamente, he estado teniendo rigidez y debilidad en los músculos del cuello. Como las articulaciones me han madurado, me cuesta funcionar sin quedarme rígido. Además, caminar ha sido bastante doloroso."
550,"Acné","Últimamente me ha salido una erupción muy mala en la piel. Está llena de granos llenos de pus y puntos negros. La piel también me ha estado escociendo mucho."
551,"Acné","Me acaba de salir una erupción severa en la piel. Está obstruida con granos llenos de pus y puntos negros. La piel también ha estado bastante sensible."
552,"Acné","Últimamente me ha estado saliendo una erupción terrible en la piel. Abundan los puntos negros y los granos llenos de pus. Además, la piel me ha estado escociendo mucho."
553,"Acné","Recientemente he estado experimentando una erupción cutánea severa. Hay puntos negros y granos llenos de pus por todas partes. Además, la piel me ha estado escociendo mucho."
554,"Acné","Últimamente he tenido una erupción muy poco saludable en la piel. Está llena de granos llenos de pus y puntos negros. La piel también me ha estado escociendo muchísimo."
555,"Acné","Me acaba de salir una erupción desagradable en la piel. Está llena de granos llenos de pus y puntos negros. La piel también ha estado muy sensible."
556,"Acné","Me acaba de aparecer una erupción desagradable en la piel. Hay puntos negros y granos llenos de pus por todas partes. Además, la piel ha estado extremadamente sensible."
557,"Acné","Recientemente experimenté una erupción cutánea severa. La están obstruyendo puntos negros y granos llenos de pus. Además, la piel ha estado bastante irritada."
558,"Acné","Últimamente la piel me ha estado severamente eruptiva. La han bloqueado puntos negros y granos llenos de pus. La piel también ha estado bastante delicada."
559,"Acné","Últimamente he estado experimentando una erupción cutánea con muchos granos llenos de pus y puntos negros. La piel también me ha estado escociendo mucho."
560,"Acné","Una erupción cutánea con varios granos llenos de pus y puntos negros me ha estado molestando últimamente. Además, la piel me ha estado escociendo mucho."
561,"Acné","Ahora me ha salido una erupción repugnante en la piel. Hay granos llenos de pus y puntos negros por todas partes. La piel también ha estado muy sensible."
562,"Acné","Me ha salido una erupción horrible en la piel. Hay puntos negros y granos llenos de pus por todas partes. Además, la piel ha estado excesivamente sensible."
563,"Acné","Me acaba de aparecer una erupción desagradable en la piel. Hay puntos negros y granos llenos de pus por todas partes. Además, la piel ha estado extremadamente sensible."
564,"Acné","Mi piel simplemente ha adquirido una erupción desagradable. Está llena de granos llenos de pus y puntos negros. La piel también ha estado muy sensible."
565,"Acné","Me ha salido una erupción terrible en la piel que no es heredada. Tiene muchos puntos negros y granos llenos de pus. Además, la piel ha estado excesivamente sensible."
566,"Acné","Recientemente, he estado experimentando muchos brotes de acné con granos que contienen pus. También he estado luchando con los puntos negros."
567,"Acné","Me he despertado esta mañana y me he encontrado con una erupción realmente desagradable por toda la piel. Hay un montón de puntos negros y granos llenos de pus. La piel también me ha estado escociendo mucho."
568,"Acné","He estado notando una erupción realmente desagradable en la piel últimamente. Está cubierta de puntos negros y granos llenos de pus. La piel también me ha estado escociendo mucho."
569,"Acné","Me acaba de salir una erupción realmente desagradable en la piel. Hay montones de puntos negros y granos llenos de pus. La piel también me ha estado escociendo mucho."
570,"Acné","He estado lidiando con una erupción realmente desagradable en la piel últimamente. Está cubierta de puntos negros y granos llenos de pus. La piel también me ha estado escociendo mucho."
571,"Acné","Me he despertado esta mañana y me he encontrado una erupción realmente desagradable en la piel. Hay un montón de puntos negros y granos llenos de pus. La piel también me ha estado escociendo mucho."
572,"Acné","He estado luchando con una erupción realmente desagradable en la piel últimamente. Está cubierta de puntos negros y granos llenos de pus. La piel también me ha estado escociendo mucho."
573,"Acné","Me acaba de salir una erupción realmente desagradable en la piel. Hay montones de puntos negros y granos llenos de pus. La piel también me ha estado escociendo mucho."
574,"Acné","He estado lidiando con una erupción realmente desagradable en la piel últimamente. Está cubierta de puntos negros y granos llenos de pus. La piel también me ha estado escociendo mucho."
575,"Acné","Recientemente me ha salido una erupción terrible en la piel. Está plagada de puntos negros y granos llenos de pus. La piel también me ha estado escociendo por todas partes."
576,"Acné","Hace poco me salió una erupción horrible en la piel. Hay varios puntos negros y granos llenos de pus. La piel también me ha estado escociendo mucho."
577,"Acné","Esta mañana al despertarme, he descubierto que tengo una erupción extremadamente mala por todo el cuerpo. Hay varios granos llenos de pus y puntos negros por todos lados. La piel también me ha estado escociendo mucho."
578,"Acné","Me he despertado esta mañana y he visto que tenía una erupción horrible por toda la piel. Hay varios puntos negros y granos cargados de pus. La piel también me ha estado escociendo."
579,"Acné","Me acaba de salir una erupción cutánea con varios granos llenos de pus y puntos negros. La piel también ha estado bastante sensible."
580,"Acné","Una erupción cutánea con varios granos llenos de pus y puntos negros me ha estado molestando últimamente. Además, la piel me ha estado escociendo mucho."
581,"Acné","Me he despertado esta mañana y me he encontrado con una erupción terrible por todo el cuerpo. Hay puntos negros y granos llenos de pus por todas partes. Además, la piel me ha estado cambiando mucho."
582,"Acné","Al despertarme esta mañana, me he dado cuenta de que tenía una erupción severa por todo el cuerpo. Hay muchos granos llenos de pus y puntos negros por todas partes. La piel también me ha estado escociendo mucho."
583,"Acné","Recientemente me ha salido una erupción terrible en la piel. Está plagada de puntos negros y granos llenos de pus. La piel también me ha estado escociendo."
584,"Acné","Me he despertado esta mañana y he visto una erupción horrible en la piel. Hay varios puntos negros y granos cargados de pus. La piel también me ha estado escociendo."
585,"Acné","Esta mañana al despertarme, he descubierto una erupción extremadamente mala en la piel. Hay varios granos llenos de pus y puntos negros por todos lados. La piel también me ha estado escociendo mucho."
586,"Acné","Recientemente he estado batallando con una erupción que pica bastante en la piel. Tiene granos llenos de pus y puntos negros por todas partes. La piel también me ha estado escociendo mucho."
587,"Acné","Esta mañana, me he dado cuenta de que tenía una erupción importante por todo el cuerpo. Hay muchos granos llenos de pus y puntos negros por todas partes, y la piel me ha estado escociendo mucho."
588,"Acné","Hoy me he despertado y me he encontrado con una erupción importante por todo el cuerpo. Hay muchos granos llenos de pus y puntos negros por todas partes, y la piel me ha estado escociendo mucho."
589,"Acné","Me he despertado esta mañana y me he encontrado con una erupción importante por todo el cuerpo. Está cubierta de granos llenos de pus y puntos negros, y la piel me ha estado escociendo mucho."
590,"Acné","Esta mañana, he visto una gran erupción por todo el cuerpo. Hay muchos granos llenos de pus y puntos negros por toda la cara, y la piel me ha estado escociendo mucho."
591,"Acné","He descubierto que tenía una erupción significativa por todo el cuerpo esta mañana. Los puntos negros y los granos llenos de pus están proliferando, y la piel me ha estado escociendo mucho."
592,"Acné","Ayer, noté una erupción enorme por toda la piel. Hay muchos granos llenos de pus y puntos negros por toda la cara, y la piel me ha estado escociendo mucho."
593,"Acné","Ayer descubrí una erupción enorme en la piel. Tengo la cara cubierta de puntos negros y granos llenos de pus, y la piel me ha estado escociendo mucho."
594,"Acné","Tengo una erupción horrible en la piel que es absolutamente no heredada. Abundan los puntos negros y los granos llenos de pus. Además, la piel ha estado bastante sensible."
595,"Acné","Mi piel simplemente ha desarrollado una erupción no heredada. Tiene muchos granos llenos de pus y puntos negros. Además, la piel ha estado bastante sensible."
596,"Acné","Al despertarme esta mañana, he visto una erupción severa por toda la piel. Hay muchos granos llenos de pus y puntos negros por todas partes. La piel también ha estado cambiando mucho."
597,"Acné","Al despertarme esta mañana, he visto una erupción terrible en la piel. Hay puntos negros y granos llenos de pus por todas partes. Además, la piel ha estado cambiando mucho."
598,"Acné","Recientemente he luchado con una erupción cutánea realmente irritante. Tiene puntos negros y granos llenos de pus por todas partes. Además, la piel me ha estado escociendo mucho."
599,"Acné","Recientemente he estado lidiando con una erupción que pica en la piel. Está cubierta de granos llenos de pus y puntos negros. La piel también ha estado bastante sensible."
600,"Asma Bronquial","He estado sintiéndome extremadamente cansado y débil, y también he estado tosiendo mucho con dificultad para respirar. Tengo fiebre muy alta y produzco mucha mucosidad al toser."
601,"Asma Bronquial","Tengo una tos que no se me quita y estoy agotado. He estado tosiendo mucosidad espesa y mi fiebre también es bastante alta."
602,"Asma Bronquial","Tengo tos persistente y me he sentido bastante fatigado. La fiebre está por las nubes y tengo problemas para respirar. Al toser, también expulso mucha mucosidad."
603,"Asma Bronquial","He estado teniendo problemas de agotamiento, tos seca y respiración. Tengo fiebre muy alta y he estado tosiendo mucha flema espesa y mucoide."
604,"Asma Bronquial","Me siento realmente fatigado y débil, y tengo una tos fuerte. Mi fiebre es muy alta y la respiración se ha vuelto superficial. Al toser, también me sale mucha saliva."
605,"Asma Bronquial","He tenido mucha somnolencia, una tos que no se va y dificultad para respirar. He estado tosiendo mucha saliva espesa y mucoide, y tengo fiebre alta."
606,"Asma Bronquial","Doctor, he tenido fiebre alta desde hace unos días, la saliva se me ha vuelto espesa, tos seca y también se nota debilidad."
607,"Asma Bronquial","Tengo una tos que ha durado días y me siento muy débil y cansado. Mi fiebre es alta y la respiración se ha vuelto forzada. Al toser, también genero mucha mucosidad."
608,"Asma Bronquial","Mamá, papá, últimamente me siento muy cansado y débil, y he tenido esta tos que simplemente no se va. Me cuesta recuperar el aliento y mi fiebre ha sido muy alta. Al toser, estoy produciendo mucha mucosidad."
609,"Asma Bronquial","Hola mamá, hola papá, me he sentido realmente agotado últimamente y he tenido esta tos persistente. Mi respiración se ha vuelto superficial y la fiebre es muy alta. También he estado tosiendo mucha flema espesa y mucoide."
610,"Asma Bronquial","Recientemente, me he sentido bastante débil y agotado, y también he tenido una tos que simplemente no se va. Mi fiebre ha sido muy alta y me ha costado recuperar el aliento. He estado produciendo mucha mucosidad al toser."
611,"Asma Bronquial","Me he sentido terriblemente débil y agotado, y también he tenido una tos que no se va. Mi fiebre ha sido excepcionalmente alta y me ha costado intentar recuperar el aliento. He estado creando mucha mucosidad al toser."
